{
  "periodKey": "#001",
  "vatDueSales": 100.00,
  "vatDueAcquisitions": 100.00,
  "totalVatDue": 200.00,
  "vatReclaimedCurrPeriod": 100.00,
  "netVatDue": 100.00,
  "totalValueSalesExVAT": 500,
  "totalValuePurchasesExVAT": 500,
  "totalValueGoodsSuppliedExVAT": 500,
  "totalAcquisitionsExVAT": 500,
  "finalised": true
}